StreetSmart,https://hophacks-fall-2019.devpost.com/submissions/126596-streetsmart,"Inspiration

We were inspired by Braess's Paradox - the phenmenon that adding a road segment to a network can actually increase overall travel times, because of the tragedy of the commons. It follows that deleting certain road segments can decrease overall travel time. This phenomenon has been repeatedly observed in the world, such as with the Cheonggyecheon Bridge in Seoul, South Korea, the road network in Stuttgart, Germany, or 42nd Street in New York City.

The benefits of doing so are varied. Americans spent 8.8 billion hours stuck in traffic in 2017, for a total financial cost to the nation of $166 billion. The trends are only getting worse; by 2020 the costs are projected to rise to $200 billion. Baltimoreans suffer particularly due to traffic congestion; our city ranks 22nd-highest in amount of time motorists spend in traffic. The cost to each motorist is 59 hours, 22 gallons of gasoline, and $960 wasted per year.

Innovative and novel solutions are needed. Braess's Paradox results in inefficiencies that can up to double overall travel time in a network, so isolating and removing roads that are contributing to congestion can help alleviate traffic congestion. These road segments can be converted to pedestrian-friendly streets and plazas, which can make neighborhoods less congested, more small-business friendly, and more human-centric!

What it does

StreetSmart is a tool to identify real-world streets like the one in Braess's Paradox, which would improve overall traffic conditions if removed. 

How we built it

We began by finding open source road map data that was query-able by address.  We decided that OSMnx--a Python package for interfacing with Open Street Maps--was the best way to conduct our queries and eventually build our dynamic overlay maps.  Next, it was necessary to construct a reasonable model for traffic. We reviewed resources on traffic modeling, formulated the problem, and began experimenting with Python.

Once we had a working traffic model with actionable results, the next task was to deploy our tool to the Web. Luckily, with the help of Google Cloud, we were able to set up a virtual machine to run our service.

Challenges we ran into

We were presented with three major challenges:


Coming up with a realistic model. We applied intuitive principles (""conservation of cars"") to make sure our model reflected the theory and reality of cities. 
Optimizing our algorithms to enable real-time results. We rewrote a large portion of our Python code in C++, achieving 100x speedups.
Overcoming deficiencies in libraries. For instance, the library OSMnx had limited interoperability with Folium. We had to modify some functions to enable road coloring.


Accomplishments that we're proud of

We are proud to have created an end-to-end solution that works. To our knowledge, this is the first open traffic modelling tool specifically aimed at addressing Braess's paradox. We hope our tool can help cities transition towards more pedestrian-friendly, community-centered, social layouts.

What we learned


Overlap between computing problems and social problems
C++ is much faster than Python
How to use Google Cloud to host a web service


What's next for StreetSmart

StreetSmart relies on OSMnx to interact with Open Street Maps. However, OSMnx uses a graph middleman package: NetworkX.  NetworkX provides a lot of unnecessary functionality and makes the final steps of our graph processing slow for large areas. We would hope to reduce wait time for generating dynamic maps by implementing our own graph library, likely in a lower level language.
",,,,"Best use of Google Cloud, Best Hack for Social Good (J. P. Morgan), Best Hack for a Philanthropic Cause (Bloomberg), Best Hack for Mental and Physical Well-being (Accenture)","python, c++, osmnx, flask, folium, google-cloud, openstreetmap, html, css",0,"Johns Hopkins University, Stanford University",,Google Cloud,nnaparst,"Johns Hopkins University, Stanford University",3,ccosgrove,EricZelikman,karosterbauer
USleepin?,https://hophacks-fall-2019.devpost.com/submissions/126598-usleepin,"Inspiration and what it does

""USleepin?"" is a Google Chrome Extension inspired by a research study conducted by the Imperial College of London, which showed the impact of sleep deprivation on physical reaction time, working memory, and productivity. In this extension, users have the ability to select time intervals between 15 minutes to 1 hour. Each time that the user's selected time interval elapses, a popup will appear and direct the user to an interactive response stimulus which records their reaction times. After playing the response game, users can view the analytics and history of their response time plotted on a graph to visualize the effects of sleep deprivation on their alertness. The anticipated audience of this app would be college students who regularly or occasionally need to stay up to complete assignments or study for exams. It can also be applied to individuals who practice unhealthy sleeping habits because the app can quantify how their productivity and work is negatively impacted by their tiredness.

The purpose of this app is to allow users to identify when their alertness is no longer at peak performance and they should really, as we say, ""go to sleep ya fool!""

How we built it

Overall design features a simplistic chrome extension plugin that utilizes javascript components within an html body that enables pop-ups that redirect the user to the alertness test at specific intervals of time that the user specifies through buttons within the chrome extension pop-up. After the test, the page redirects you to an Analytics page, where a plot of a user's general alertness is featured, as well as our story and introduction. We regularly committed and pushed our files to Github. We linked all of our files through the html script and src tags via buttons and functions we wrote in javascript. We wrote a basic interval-based repeating timer, as well as our own 'game' where the image disappears and reappears randomly throughout a canvas for a set period of time. We store our data on the web app.

Most PNG images were designed on Adobe Illustrator with a Intuos drawing tablet. Gifs were created as frame animations generated with Photoshop.

Challenges

As a team, we ran into a variety of issues. In particular, working with javascript and HTML were difficult because these languages are often finicky, and most of our team members had little to no experience coding in javascript, which is the code that was predominantly used in the final product. In order to maintain the authenticity of the app, we wanted to design most of our own graphics, which required vector images. Consequently, we experienced a couple mishaps with adobe illustrator, including the loss of a graphic that we spent hours on.
Perhaps the most challenging part of the project was actually brainstorming ideas for the app. While we wanted to develop something impressive, we also wanted to make sure the task was accomplish-able with our given skill sets. Naturally, as the hours dragged on, fatigue became an issue that we had to overcome and working through coding errors and graphic design on minimum sleep resulted in moments of severe frustration and lots of ""I don't know what I'm doing!!!!!!"" Though it certainly felt like we were part of the Great British Bake Off (but with code instead of batter) we certainly had a good time and felt reassured by the communication and camaraderie of our group.

Accomplishments that I'm proud of

We are definitely proud of our ability to work as a team. We collaborated and communicated effectively and we all approached the Hackathon with a positive mindset, high spirits, and determination. We also played to each of our strengths which allowed us to not only produce a relatively polished finished product, but to also learn new things about the techniques and languages we were already familiar with. We are proud to have created an awesome new chrome extension with tons of exciting new ideas that are ready to be expanded upon. 

What I learned

Within a span of 36 hours, we learned how to code in javascript, manipulate adobe illustrator more efficiently, generate vector images, and work with HTML and CSS styling.

What's next for USleepin?

We have lots of exciting new things in store for ""USleepin?"" We hope to: make the game longer to better test the reaction speeds and attention spans of our users, save the history of past reaction speed attempts, make a leaderboard showcasing user's top reaction speed times, improve the alert system of our extension by making alerts appear at the bottom of page, change the time buttons to sliders ( so there is more flexibility to specify desired time intervals), generate a page that yells at the user to GO SLEEP when the user's reaction speed falls below an average threshold and add a larger variety of games to keep users on their toes.
Future applications of ""USleepin?"" include: sharing the app with the student body so that they can be more conscience of their sleep health, publicizing the app as an accessible tool for sleep and cognitive function research, and adding more sheep gifs to maximize cute factor.
",https://youtu.be/M6yGPK2aKvw,https://github.com/Reemeela2121/yousleepin.git,,"Best Healthcare Hack (Siemens), Best Hack for Social Good (J. P. Morgan), Best Hack for a Philanthropic Cause (Bloomberg), Best Hack for Mental and Physical Well-being (Accenture)","html5, css3, javascript, json, gif, png, vector",1,Johns Hopkins University,,,Reemeela2121,Johns Hopkins University,3,slu29,ntucai1,avulaj1
Discourse,https://hophacks-fall-2019.devpost.com/submissions/126609-discourse,"Inspiration

Discussing a topic with others is one of the best ways to demonstrate knowledge about a subject, and to fix it where it is lacking. With careful engineering, computers should be able to take part of that conversation too.

What it does

We built a voice-based study tool that engages users with a set of questions about a topic - to which they respond in natural language. Our tool then evaluates their responses and points out what might be missing.

How we built it

We used Google's Dialogflow to handle intent inference and the flow of conversation. We then deployed the agent onto Google Assistant, which is available on mobile devices. Questions and evaluations are routed to the agent from a python webserver, which uses Facebook's Fasttext word embeddings to score the quality of responses and note where there are errors.

Challenges we ran into

None of us have experience with NLP, so understanding what a good approach was, and then navigating the set of available tools was difficult, and we fully implemented two solutions with poor results before finally settling on Facebook's Fasttext + a custom scoring algorithm.
In addition, three of us were not very comfortable with python, and none of us knew much about Dialogflow. There was a lot of learning involved on all sides!

Accomplishments that we're proud of


Learning about NLP, and implementing our first NLP solution
Making an actual application that works and that someone can use.


What we learned


A crash course on word embeddings
Dialogflow
Python
The value of having fun - but we already knew that


What's next for Discourse

Writing a more comprehensive set of questions and answers to inform how we evaluate and modify our approach. It would be best to collaborate with an education company in a specific domain to fine-tune our ideas. It is also important that we polish the interface, maybe as part of our own app.
",,https://github.com/stewy33/hophacks2019,,Best use of Google Cloud,"dialogflow, google-web-speech-api",1,Johns Hopkins,,Google Cloud,stewy33,Johns Hopkins University,1,harshild24,,
Dorothy ,https://hophacks-fall-2019.devpost.com/submissions/126610-dorothy,"Dorothy - Smart Therapist, Caring Friend in Your Pocket

Inspiration

Mental health should not be an issue that is ignored. Therapy should be something that you don't loathe, or avoid. We know that mental health treatment is an important part of a child’s healing and that addressing the impact of trauma on the child significantly reduces harm and decreases the risk for future abuse. Therapy can help a child work through difficult, confusing and painful feelings in a 
safe setting. Therapy also provides children with the tools for going forward and
leading healthy, productive lives. This is why we developed Dorothy.

What it does

Dorothy is AI-powered friend with intuitive understanding of young people's well-being, especially the youth. Dorothy is able to detect real-time emotion from tone of voice, facial recognition and sentimental analysis of text. Since Dorothy is geared towards adolescent, we make the app to be more interactive and engaging by providing features from music suggestion to self-guided meditation. We also add feature to locate the closest and most needed help resource based on the sentiment analysis and NLP

For young working adult, Dorothy uses NLP to be that hearing ears in a lonely night in New York City.

How we built it (with brain)

User-Interface

We start with a focus on intuitive and eye-catching UI/UX. To do so, we use Flask Framework, Javascript, Html and Css.

Speech-to-text

Next, we brainstorm what is the best approach to a quite challenging topic. Understanding that most adolescent feels more comfortable express themselves through spoken words than text, we decided to first work on the speech-to-text feature. To do so, we use Microsoft Azure Speech Recognition Api and flask to properly display the output.

Text Sentimental-Analysis

To do so, we use TextBlob library in python. Dorothy is able to differentiate emotion based polarity and subjectivity.

Emotion Facial Recognition

We use OpenCv to have a real-time emotion detection. For Facial recognition, we use Tensorflow Emotion Recognition Face API. Dorothy is then able to enhance her emotion recognition features to encompass more emotion, such as Fear, Disgusting, Angry, Neutral, Happy, Surprise.

Natural Language Processing Help-Bot

We train a bot on Cornell movie dataset to be able to understand the english semantic as well as answer any question in the most natural way. Dorothy then incorporates Text Sentimental-Analysis and Emotion Facial Recognition to help user either talk their feeling out or guide them to the next proper step. 

Brain and Psychology Domain Knowledge

Dorothy is built on the foundation of Cognitive Behavioral Therapy, Psychotherapist and Human Development understanding!

Challenges we ran into

Well. There were a lot. First one is probably getting lost in John Hopkins University.

Second is to find optimal solution that incorporates Cognitive Behavioral Therapy as well as Artificial Intelligence to solve a challenging problem.

Regarding technical challenges, there are some aspects we are less proficient than other but we were able to put every piece together efficiently!

Accomplishments that we're proud of

Probably most of the project. This is an idea that we have for a long time and finally we bring into fruition. However, we are most proud of the fact that we help solve a problem that we are both concern about!

What we learned

Sleep is optional!
Other than that, I (Hang) feel like I gain +1 level in JavaScript and Flask proficiency.

What's next for Dorothy - Your Digital Friend

WOW! we have a lot more in store for Dorothy.


Have a MVP for iOS and Android app
I (Hang) am personally super excited to add in Tone Emotion Detection. That is why we initially come up with the idea to do speech-to-text feature. Tone of voice shows a wider range of emotion. Then, we will enhance Dorothy's ability to understand emotion further.
We would love to take the NLP further to be more suitable for the audience. Using a bigger and more appropriate dataset will help Dorothy to sound professional and caring like a true friend.
Finally, we want to create a wellness report for the user based on the conversation. For example, if there is a trend in their mood getting better and what is the reason for such. Ultimately, I am really interested in the collecting a dataset that helps researcher and scientist understand the early sign of depression in adolescent!

",,https://github.com/rgangu/dorothy,,"Best Healthcare Hack (Siemens), Best Hack for Social Good (J. P. Morgan), Best Hack for a Philanthropic Cause (Bloomberg), Best Hack for Mental and Physical Well-being (Accenture)","flask, neural-networks, tensorflow, keras, opencv, tensorflow.js, javascript, python, azure, google-cloud, natural-language-processing, html5, css3, textblob",1,Penn State,,,rgangu,Pennsylvania State University,1,Hangpanbee,,
HiJean: Helping with basic needs,https://hophacks-fall-2019.devpost.com/submissions/126630-hijean-helping-with-basic-needs,"Situation: During the sponsor talks, it was brought up that people in poorer communities would choose hygiene products over food. Hence this brought the idea of a donation application to link individuals who are willing to help others and those in need.

The application displays people in need in the area, with a list of items (such as toiletry and clothing) they may need. Once they find something they lack, they contact the provider for a transaction meetup. After the exchange takes place, the user is reward with a karma system based on the type of items donated, and the frequency of giving.

We hope to create a stronger link between those in need and those who want to help through this mobile application, since the communities in need report using their phones as a mean to the internet.
",,https://github.com/xapatjb4/HopHack19,,"Best Healthcare Hack (Siemens), Best Hack for Social Good (J. P. Morgan), Best Hack for a Philanthropic Cause (Bloomberg), Best Hack for Mental and Physical Well-being (Accenture)","javascript, android, ios, flutter, node.js",1,UMass Dartmouth,,,xapatjb4,University of Massachusetts - Dartmouth,1,agrozdani,,
SafeJourney,https://hophacks-fall-2019.devpost.com/submissions/126631-safejourney,"What is our project?
The purpose of SafeJourney is to provide its users with a navigation system
that factors police crime data into its algorithm to navigate away from
dangerous streets. It maps the shortest and safest route from point A to
point B. Police reports update the algorithm with current crime information
to constantly adjust and improve its pathing.

Why our project?
We want our project to help Baltimore residents stay safe in their day to
day life. Kids can walk to school on safer paths.

USAGE
Currently, this application is based entirely within your terminal. Compile
every .java file. Run StreetSearch with the following arguments: mapfile,
start Latitude,Longitude pair, and end Latitude,Longitude pair.

example:
$ java graphFiles.StreetSearch graphFiles/baltimore.txt -76.6063,39.2907
-76.6136,39.3195

FUTURE GOALS
-Planning to build app with gui
-updating info and filtering it based on type of crime more thoroughly
-being more precise/predictive in the severity of danger in various areas
-give more detailed directions with a focus on accessibility for all users
-Implement more efficient A* shortest path algorithm
",,http://github.com/dskaff/hophacksfall2019,,"Winner of FastForward U (FFU), Best Hack for Social Good (J. P. Morgan), Best Hack for a Philanthropic Cause (Bloomberg)",java,1,Johns Hopkins University,,,jmkurlander,Johns Hopkins University,2,dskaff1,emilyzeng328,
Cross Lingual Information Extraction for your everyday needs,https://hophacks-fall-2019.devpost.com/submissions/126643-cross-lingual-information-extraction-for-your-everyday-needs,"Inspiration

We're motivated by the necessity to remove linguistic barriers to information and enable access to both sides of a story.

What it does

It lets you search the web in a language you know(eg. English ) for information that might be present in a foreign tongue. This project is a result of labour of love. 

How we built it

We translate your QUERY into languages of your choice. We then search the internet for both your query and the Translated Queries.  The results of the queries are then RANKED using algorithms trained on MS Marco reranking. We then take the top 5 resulting pages and using our QUESTION ANSWERING system to extract an answer to your searched Query instead of just showing you a list of pages.

Challenges we ran into

A major challenge we faced was handling a high volume of translation traffic. 

Accomplishments that we're proud of

A high quality search engine that gives more contextual, appropriate search results for regional, language specific search queries.

What we learned

Leveraging API calls for automated search and translation, question answering using SOTA models.

What's next for cross-lingual-QA-MSMARCO

Auto-detect language of query and translation.
",,https://github.com/abhinonymous/cross-lingual-QA-MSMARCO,,,"python, shell",1,johns hopkins university,,,abhinonymous,Johns Hopkins University,1,aniruddha16293,,
Math Pix PDF Full Scan,https://hophacks-fall-2019.devpost.com/submissions/126665-math-pix-pdf-full-scan,"Inspiration

I was amazed when I saw how accurate and quick Mathpix was during the opening presentation. It caught my eye because of the possibilities it could lead to, and building on top of the API today showed me how great the potential is for this technology. 

What it does

Mathpix is a great piece of software that is able to detect text AND handwriting and turn it into LaTex, a mark up language, where it is then printed on to the screen for digital use. What I created was a program that took the Mathpix API and made it so instead of being able to only parse a couple lines of writing, it is now able to scan through a whole PDF page and convert that into LaTex. No more having to manually partition the photos yourself.

How I built it

The program was built with Python, and utilized many python libraries such as json, pdf2image, PIL, and more.

Challenges I ran into

I had no knowledge of what LaTex was going into this, and minimal idea of how to even work with JSON and APIs. I was also in a team by myself, so I was short on manpower, data processing, and skills.

Accomplishments that I'm proud of

I am extremely proud of being able to learn so much about JSON, APIs, and LaTex, but most of all I am happy that I was able to create an application that satisfied the hacking criteria all by myself.

What I learned

Aside from the bigger pieces of code that I mentioned earlier, the biggest take away from this project was reading and understanding library documents and sample code. Without these I would have been no where.

What's next for Math Pix PDF Full Scan

I really wanted to incorporate OpenCV OCR and have the text be partitioned in a more precise and mathematical way, but it was out of my scope at the moment. With more time I would add functions that reduce the time complexity because the program is just a bit too slow for my liking. 
",,https://github.com/chuefeng/HopHacks19,,,"python, json, os, slice, api, snipnotes",1,UMass Dartmouth,,,ChuefengVang,University of Massachusetts - Dartmouth,0,,,
