Leap Alert,https://hophacks-fall-2019.devpost.com/submissions/126840-leap-alert,"Inspiration

Our team identified a specific problem in a large portion of the community - the lack of resources of available for allowing children with autism (or other similar communication/social impairments) to communicate safely and comfortably. One of our team members has a sibling with autism and can vouch for the difficulties those with autism face in communicating their needs effectively as well as the difficulties faced by the parents of those with autistic children. Busy parents fear leaving their child alone even for short periods of time.

What it does

Our software is a web application which connects to an external motion detection software (Leap Motion) in order to recognize simple hand swipe gestures to select certain commands. These commands serve to either communicate emergency concerns to the user's parents or to calm a user down if they are distressed. Those who will be using this software's gesture detection software will be those with autism. The inability for those with autism to communicate effectively prevents them from being able to efficiently alerting their parents of concerns through text or phone call. However, Leap Alert allows those with autism to form a basic connection between a hand gesture and a concern they may be able to communicate. Beyond this, the users with autism can also select from a list of videos which can calm them down. Those with autism often have certain, specific interests which can calm them if they are stressed and Leap Alert allows these users to access videos, audio clips, or images which might aid in this. The final product is a grid of options that the user can choose from. Rather than having to read text messages or call, the user can look at images and select images associated with concerns using hand gestures.

How we built it

Leap Alert is built on several API's and programming languages - namely, JavaScript, HTML, PHP, LeapJS, and Python. The application's software design is built around the Leap Motion software and sensor. The Leap Motion's motion detection software provided us the idea to recognize gestures to alert parents, so we needed to figure out how to receive and recognize gestures, and how to send out a message alerting parents. The former task involves understanding and implementing Leap Motion software and making use of LeapJS libraries. The latter task involved knowledge of how to send emails using PHP. This evolved into sending SMS with PHP with the aid of the Twilio public library. In order to have our application be able to be used directly with the motion detector in front of a computer where the user can see the results of their gestures in real time, JavaScript was needed. A combination of JavaScript and HTML was used to create a visual aid which depicts what options the user has to choose from. The JavaScript code had to work seamlessly with the data streaming from the motion detection software. Finally, to be able to send out an SMS with PHP code with JavaScript code, we required the use of the Python Flask library. This allowed us to create a server which runs Python using JavaScript. The Python code then runs a PHP file and sends out an SMS text alert.

Challenges we ran into

The process of creating a final product to demo was a difficult and tiring one. It required 6 laptops, all three Leap Motion sensors, and an Oculus Rift headset. In the beginning, we established that we would like the application we create to utilize the Leap Motion hardware and assist those with communication disabilities. However, it was quite difficult narrowing down the many ideas we had for how we could go about this. One idea we had was to use the Oculus Rift to train those with Autism how to utilize certain gestures to achieve certain results. Another idea we had was to make use of an Android phone application that those on the spectrum could use.
Aside from the process of idea creation, we ran into hardware problems as well. The Leap Motion software did not work very well on everyone's laptops. Issues with one laptop were solved by another, but it generated new issues. We checked out an AlienWare laptop to help process visual data better. Ultimately we narrowed down what we needed out of the hardware and chose which laptops would be most compatible for these needs. The challenges do not end there either! We were all new to PHP and getting an email and SMS to send was difficult. Then, getting JavaScript to run PHP code was also difficult! The internet claimed it was not easily possible to run PHP with JavaScript, but we used the Flask software to work around the incompatibility. There were also countless issues with debugging and making user interface smoother and finding the necessary software to download to our computers. However, we successfully made a demo to show what our application intends to do for those with autism. 

Accomplishments that we're proud of

The biggest accomplishment was most likely getting a working, clean demo with a team made mostly of first time hackers! We were also unfamiliar with PHP and Leap Motion technology, but we got accustomed to it just in time for creating our application. 

What we learned

We learned how to effectively make use of a diverse array of API's, how to use PHP, and how to conjure solutions to facilitating user experience. One of the most useful things we learned is how to use Python in a webpage (which conveniently allowed us to run PHP code with JavaScript!).

What's next for Leap Alert

Leap Alert was intended for children with autism. However, this technology can be extended to more than just those on the spectrum. Children with speaking disabilities, young children unable to speak, and even the elderly who have a hard time raising their voice can make use of an application such as Leap Alert to send out distress signals if they cannot easily speak up. As for the front end and back end aspects of our software, we would like to see Leap Alert be customizable for users (controlling how many grid squares the user has access to, what the external media is, etc). Furthermore, we would like to finish the design of the web application so that relevant images are actually displayed on the grid square (this is so that the users are not required to read what is written on the squares). 
",https://youtu.be/a_7Ots_CSyQ,https://github.com/siqicao/Leap-Alert.git,,"Best Healthcare Hack (Siemens), Winner of FastForward U (FFU), Best Hack for Social Good (J. P. Morgan), Best Hack for a Philanthropic Cause (Bloomberg), Best Hack for Mental and Physical Well-being (Accenture)","python, javascript, php, html, twilio, flask, leap-motion",1,Howard University; University of Maryland; Georgia Institute of Technology,Leap Motion,,scao,"University of Maryland - University College, Georgia Institute of Technology - Main Campus, Howard University",3,aupadhayay3,jdhendricks727,cryptonon
hophacks2019,https://hophacks-fall-2019.devpost.com/submissions/126841-hophacks2019,"hophacks2019

Using fitbit API to improve health related problems.

Description

This is a prototype built during hophacks 2019 of a software with the goal of using the fitbit API to monitor biometric readings given by the device to alert the users chosen individuals via sms messaging, using twillo, that the user is having an emergency. In it's current iteration its used to monitor for anxiety levels and panic attacks based off the users heart rate, sleep patterns, and calorie intake.

Collaborators

Elijsha

Marty

Rendell
",,https://github.com/speedykai/hophacks2019,,"Best Healthcare Hack (Siemens), Best Hack for Social Good (J. P. Morgan), Best Hack for Mental and Physical Well-being (Accenture)","jupyter-notebook, python, c++, makefile, batchfile, processing",1,"Germanna community college, George Mason University, Northern Virginia Community College",FitBit Ionic,,elijshamingus,"Germanna Community College, Northern Virginia Community College, George Mason University",2,speedykai,IntenseMarrow9,
SFNC CARPOOL,https://hophacks-fall-2019.devpost.com/submissions/126843-sfnc-carpool,"hophacks_carpool

This is a carpooling app called ""SFNC CARPOOL"" for the community in Baltimore, to mainly serve the transportation needs of students. It aims to provide updates and notifications for transportation for children to school and co-curricular activities and events. It also allows the community to keep track of the movement of children in general, and create networks of families and children with similar interests, while providing safe transportation for them.
",,https://github.com/lynetteljm/hophacks_carpool,,Best Hack for Social Good (J. P. Morgan),"java, xd",1,"Georgetown University, Singapore Management University",,,lynetteljm,Singapore Management University,1,trisfaulknerma,,
BaltiWatch,https://hophacks-fall-2019.devpost.com/submissions/126844-baltiwatch,"Inspiration

Past improper disposal, leaks, hazardous materials and wastes have resulted in tens of thousands of sites across our country that have contaminated our land, water (ground water and surface water), air (indoor and outdoor). This also happens in our neighborhood, which may even affect the health of our community. As part of the Baltimore community, we want to help with this issue by providing a report platform that makes the handling of trash, biohazards, etc. easier and quicker. Additionally, it helps to get our community involved in neighborhood cleanup by building a reward system. 

What it does

BaltiWatch is an Android app that helps the Baltimore community to group up and keep our neighborhood clean. Firstly, users can report trash, biohazards, etc. on our app. Then, BaltiWatch will map and list those hazardous waste cleanup locations, drill down to details about those cleanups and provide related information on the App so that users who are in the neighborhood can help with cleaning up and earn points by completing this activity. Besides, users can also earn points by verifying whether the reported issues have been solved. Finally, users can use these points to redeem different kinds of rewards that potential sponsors provide, such as Google Cloud Credit, Free ticket for FFC Monday dining, priority registration for courses, etc. 

How I built it

We built the app using android studio (Java for the backend, xml for the frontend) and used Google's Firebase Firestore to store our data online and Firebase Authentication for user authentication.  Additionally, we used git and github for collaboration.

Challenges I ran into

We had a lot of trouble getting started.  Setting up our project with Firebase authentication and Firestore for database took the entire first night.  Additionally, there were a few select features that took a disproportionately large amount of time.  For  example, it took us a long time to implement recycler views and Google Maps integration.

Accomplishments that I'm proud of

We felt an extreme sense of accomplishment watching eachother complete more and more features and our app become more and more complete.  Every new activity created and UI element successfully connected to the firebase backend was a step towards a more complete product that we could show off to judges.  What began as an empty screen with a button and 2 texfields that we were struggling to hook up to Firebase authentication eventually became the BaltiWatch that we will present today.

What I learned

We learned a lot about team dynamics and android development during Hop Hacks.  In the beginning of the hackathon, we had frequent merge conflicts.  However, we had almost none during the second half.  Additionally, it took us an entire night to set up firebase authentication and database, but only one day to complete everything else.  

What's next for BaltiWatch

The android app we have right now is a small part of a grander plan that we came up with at the beginning of this hackathon.  Adding photography to the platform would allow us to gather more useful data about the validity and seriousness of the reports.  Additionally, adding machine learning and computer vision to the platform would allow us to analyze the data and find trends and hotspots for littering, biohazards, etc.  Finally, a webapp would be useful to present these results to administrators in the government or nonprofits to better optimize their policies and actions for the community.
",,https://github.com/mason2smart/BaltiWatch,,"Best Healthcare Hack (Siemens), Best use of Google Cloud, Winner of FastForward U (FFU), Best Hack for Social Good (J. P. Morgan), Best Hack for a Philanthropic Cause (Bloomberg), Best Hack for Mental and Physical Well-being (Accenture)","java, firebase, android-studio, firestore",1,Johns Hopkins,,,mason2techie,Johns Hopkins University,3,ChristopherXu,jerrychen017,carolyli1014
E-Balance (The Environmental Bank),https://hophacks-fall-2019.devpost.com/submissions/126845-e-balance-the-environmental-bank,"Inspiration

With the world of technology expanding at an exponential rate, a certain toll is being taken on our earth. We wanted to unite technology and environment by bringing awareness to each individual's impact and contribution to climate change. Many people feel climate change can only be solved by legislation, however with small adjustments to our own daily lives, like eating less meat or taking public transportation, we can create large change.

What it does

The environmental bank (or E-bank) for short keeps track of your literal and monetary balance with earth. Every carbon footprint can be measured in a cost it would take to offset that footprint. There are many calculators that exist online that can profile how much your emissions are contributing to climate change. These calculators however are often overbearing and too detailed for people to take the time to fill out. We've simplified the interface by only showing a few common emission categories: travel (car, bus, plane), energy (washing machines, light), and food (meat and non-meat meals). 

We hope users enter their approximate usage in these different categories on a daily basis so they can see how their E-balance adds up. They also have the option of offsetting their emissions (either that week's or their total) by donating to a nonprofit that will support renewable energy sources. This, in the long term, will help renewable energy sources grow and become more affordable/accessible to people. 

The nice part about e-balance is that the total is never going to be overwhelming. We estimated (using free carbon calculators online) that a family of four would cost less than 3 dollars per week to offset (this was only including our three categories travel, energy, and food).

A feature we would like to add to our app is a ""Friends and Accomplishments"" page where users can track their statistics (like which category they use the most emissions in) and accumulate points to level up. One of the ways users will be able to earn points is by keeping a ""streak"" with the app (logging daily in any category). With the ability to connect with friends on the app, users will feel more enticed to level up and also introduce their friends to the app.

How we built it

We built this app on Xcode using Swift. This was our first time programming an app and programming in swift. It was a very new experience and it took a while to find our feet on the platform.

Challenges we ran into

Working in a new language is always a challenge. When we ran into bugs, it took much longer to debug. Additionally, there were many features we wish we could have added (like a scrollable ""picker"" to choose between Diesel or Petrol to make different category costs more personalized) but we did not have time to learn and debug those more complicated features.

Accomplishments that we're proud of

We're pretty proud to just have created an app since it was our first time. It was very cool working in a new environment with a new language. 

What we learned

How to use the basic features of Xcode and Swift. How to make a basic app.

What's next for Environmental Bank (E-Bank)

First the friends and accomplishments page where we can track their statistics. Second to add more categories and more subcategories (like what I mentioned above about fuel type for cars). Additionally, do more research on the actual calculation of the carbon balance. Right now the numbers we are using are quite crude (just the first values we found online), so we would like to do more research to make sure we are accurate with our calculations.
",https://youtu.be/c31pw2ogo5Q,,,Best Hack for a Philanthropic Cause (Bloomberg),"xcode, swift",0,Johns Hopkins University,,,klee223,Johns Hopkins University,1,petermgoh,,
Arborist Go!,https://hophacks-fall-2019.devpost.com/submissions/126846-arborist-go,"Arborist Go!- Scan the trees around you, report their health status and get rewards! 

Out of all the 3-1-1 requests reported within the 2010-2014 period made available on the Open Baltimore database, a tremendous 17,112 entries fell under the category of tree inspection, tree maintenance and fallen trees. To put this into perspective, within the past decade, there have been 407 tree-related deaths in the US alone. 

On top of all these cries for help, the city council staff have specifically pinpointed that tree surveys are a ‘very manual process’, that require time, financial and human resources. 

Another problem that came up repeatedly, 12,831 times in fact, was the problem of illegal dumping. In St .Francis’ raw surveys of the 21217 community, residents from as young as 6 to residents as old as 79 all faced the same issue of trash and garbage management, seriously affecting their quality of life-- and definitely not helping the rodent problem. 

Arborist Go! addresses the root causes of both these challenges. 

A gamified tree mapping and monitoring tool which leverages the ethos of traditional citizen science projects whilst maintaining a sustainable business model. As users register trees, update their monthly health status and earn points, they are incentivised and rewarded with the chance to win discounts and deal coupons for eco-friendly products from collaborating companies focused on environmental causes such as Beyond Meat, Lush Cosmetics and Stainless-steel Straws. 

Arborist Go! provides tree health status alerts in real time to the local council and environmental agencies to prioritise tree inspections and provides them with a database of updated vegetation information for urban planning, evaluation and research. 

How does it treat the trash problem though? It is the opinion of many that litter and dumping are not a logistical problem in Baltimore but rather, a deep running cultural problem. By encouraging community members to get out, start exploring and interacting with their neighbourhood in a positive way, they are becoming more aware of the environment around them, hopefully stimulating the cultural shift that is needed to tackle this trash problem.

Once you create a user account on the app, users are able to scan and register trees with their phone cameras and report the health status of that tree. The geolocation and health status of the tree is then stored in the database and the user is launched into a game experience with the chance to win discount and deal coupons which are stored in their in-app wallet, redeemable at participating stores. To ensure that it is in fact a tree that is being scanned and that a single tree is only registered on the database once, the google vision API for tree recognition is employed as well as only allowing the registration of a single geolocation. 

Technologies used 
NodeJS web app, using jquery

Google vision API for tree recognition

Google map API for geolocation of user+tree

Firebase with mail authentication

Bootstrap for rendering dynamic and mobile friendly pages

Future steps

Complete database

API for detecting direction and distance of a tree

Exclusive tree detection

Better user experience
",,https://github.com/xj-m/Arborist-Go,,"Best Automation Hack with UiPath, Best use of Blockstack, Best Domain Name from Domain.com, Winner of Mathpix Challenge (Mathpix), Best Healthcare Hack (Siemens), Best use of Google Cloud, Winner of FastForward U (FFU), Best Hack for Social Good (J. P. Morgan), Best Hack for a Philanthropic Cause (Bloomberg), Best Hack for Mental and Physical Well-being (Accenture)","html, javascript, css",1,"JHU, NYU",,,xj-m,"Johns Hopkins University, New York University",3,anhaotian1996,sdh381,zlin32
VVL (Visual Verbal Learning),https://hophacks-fall-2019.devpost.com/submissions/126848-vvl-visual-verbal-learning,"Inspiration

We wanted to build a learning tool that made a huge social change and upon researching we found a condition called ""Aphantasia."" This condition entails people who deal with blindness in their mind. We were able to then apply our idea originally meant for helping language learners and visual learners for people who also deal with aphantasia. 

What it does

Our project is a website that allows a user to enter a string of text through typing or speaking through a microphone. The site then pulls key words from each sentence to display to the user images that represent the key words in their sentence. This outputs on the screen helping with learning new words with images. 

How we built it

We used Angular for the front end and Python for the back end. We also used Natural Language Processing to analyze the text and categorize the text. In addition, we used Google Custom Search Engine to make queries that return images based on the categories of the NLP. 

Challenges we ran into

We had challenges implemented Google Speech to Text API. 

Accomplishments that we're proud of

We are proud to be able to tackle something not widely focused on in the tech field and medical field. 

What we learned

We learned how to improve our empathy and best help others.

What's next for VVL (Visual Verbal Learning)

We want to implement Speech to Text and Text to Speech for the application. We also plan to develop a mobile application.
",,https://github.com/saheedandrew/TextVisualizer,,"Best use of Google Cloud, Winner of FastForward U (FFU), Best Hack for Social Good (J. P. Morgan)","angular.js, python, flask, google, google-custom-search, google-image-search, google-web-speech-api, natural-language-processing",1,"University of Oregon, Brooklyn College (2), Johns Hopkins University",,,andrewsaheed,"Brooklyn College of the City University of New York, University of Oregon, Johns Hopkins University",3,jpeter17,ayodelefarinre,nsarmoe1
BMoreSafe,https://hophacks-fall-2019.devpost.com/submissions/126849-bmoresafe,"Inspiration

Was sadden by the poor quality of life while travelling to the campus on the bus. We wanted to aid the community in any way we can.

What it does

Our website has a game that is targeted on to the youth that teaches them the dangers of substance abuse. We also have information/resources for people who are currently struggling with a substance abuse. 

How we built it

We used RenJS to build the game. The website built with HTML and CSS

Challenges we ran into

Attempting to run a local server but scrapped that idea as it wasn't necessary

Accomplishments that we're proud of

Polished website, everything runs well

What we learned

RenJS, Maps

What's next for BMoreSafe

Improvement on the game such as sounds, facial expression, and sound effects. 

Best Domain Name Submission

http://bmoresafe.online/
",,https://github.com/girikification/bmoresafe,,"Best Domain Name from Domain.com, Best Hack for Social Good (J. P. Morgan), Best Hack for Mental and Physical Well-being (Accenture)","html5, css3, renjs, baltimore-open-data",1,"Temple University, Brooklyn College, University of Maryland, University of Waterloo",,,pokelegocuber,"Brooklyn College of the City University of New York, University of Maryland - College Park, Temple University, University of Waterloo",3,theandrewhong,chiuannica,girikification
